"category","over_represented_pvalue","under_represented_pvalue","numDEInCat","numInCat","term","ontology","padj","GeneRatio"
"GO:0006354",0.00046160958003216,0.999761905013993,53,139,"DNA-templated transcription elongation","BP",0.0364029758114132,0.0123658422771815
"GO:0045893",0.000473070887947963,0.999619345358345,444,1539,"positive regulation of DNA-templated transcription","BP",0.036727537522228,0.103593093793747
"GO:0071706",0.000473196726739223,0.999744136359871,60,162,"tumor necrosis factor superfamily cytokine production","BP",0.036727537522228,0.0139990667288847
"GO:1903555",0.000473196726739223,0.999744136359871,60,162,"regulation of tumor necrosis factor superfamily cytokine production","BP",0.036727537522228,0.0139990667288847
"GO:0140546",0.000477266942851793,0.999633023346531,297,1009,"defense response to symbiont","BP",0.0368495057918083,0.0692953803079795
"GO:0006935",0.000483883155402538,0.999671915568749,138,430,"chemotaxis","BP",0.0370343745947708,0.0321978534764349
"GO:0034243",0.00048468395584124,0.999782856862821,38,92,"regulation of transcription elongation by RNA polymerase II","BP",0.0370343745947708,0.00886607559496034
"GO:0010803",0.000492644075003393,0.999808950374948,29,65,"regulation of tumor necrosis factor-mediated signaling pathway","BP",0.0374485679076033,0.00676621558562762
"GO:1900103",0.000496572352209737,0.999950552847699,9,12,"positive regulation of endoplasmic reticulum unfolded protein response","BP",0.0375536024514718,0.00209986000933271
"GO:0032490",0.000511393479173396,0.999948838045307,9,12,"detection of molecule of bacterial origin","BP",0.0384771410069902,0.00209986000933271
"GO:0050671",0.000514982832604715,0.999732611935435,53,140,"positive regulation of lymphocyte proliferation","BP",0.0385505169158463,0.0123658422771815
"GO:0043122",0.000526562033811954,0.999664200791146,104,310,"regulation of canonical NF-kappaB signal transduction","BP",0.0392182339021459,0.0242650489967336
"GO:1902680",0.000529289503420983,0.999573322038516,444,1541,"positive regulation of RNA biosynthetic process","BP",0.039223277924368,0.103593093793747
"GO:0042330",0.000537221108874363,0.999634462117098,138,431,"taxis","BP",0.0396119984628511,0.0321978534764349
"GO:0045944",0.000558588846454468,0.999563170081461,333,1129,"positive regulation of transcription by RNA polymerase II","BP",0.0408925886039542,0.0776948203453103
"GO:0071347",0.00056013446111065,0.999752728768211,36,87,"cellular response to interleukin-1","BP",0.0408925886039542,0.00839944003733084
"GO:0080135",0.000577200925275398,0.999592968688915,165,525,"regulation of cellular response to stress","BP",0.0419309460346615,0.038497433504433
"GO:0002369",0.000583886835269362,0.999829591902568,19,37,"T cell cytokine production","BP",0.0420028251693526,0.00443303779748017
"GO:0002724",0.000583886835269362,0.999829591902568,19,37,"regulation of T cell cytokine production","BP",0.0420028251693526,0.00443303779748017
"GO:0045089",0.000618812615996928,0.999583291507236,129,397,"positive regulation of innate immune response","BP",0.0440904881006249,0.0300979934671022
"GO:0043367",0.000618887301609097,0.999704967445037,42,105,"CD4-positive, alpha-beta T cell differentiation","BP",0.0440904881006249,0.00979934671021932
"GO:0051094",0.000630862511129805,0.999501416353146,358,1222,"positive regulation of developmental process","BP",0.0447275454405348,0.083527764815679
"GO:0042129",0.000638544137992039,0.999643418852769,63,174,"regulation of T cell proliferation","BP",0.0450555521673139,0.014699020065329
"GO:0032101",0.000658269157365625,0.999488262403272,308,1047,"regulation of response to external stimulus","BP",0.0458747590979241,0.0718618758749417
"GO:0050852",0.00066130834501851,0.999645118731556,56,150,"T cell receptor signaling pathway","BP",0.0458747590979241,0.0130657956136258
"GO:0006952",0.000661314558800818,0.999460936023926,477,1687,"defense response","BP",0.0458747590979241,0.111292580494634
"GO:0051098",0.000662597388476153,0.999685561994647,41,103,"regulation of binding","BP",0.0458747590979241,0.00956602893140457
"GO:0050790",0.000672722198993204,0.999522972564729,166,529,"regulation of catalytic activity","BP",0.0463581040586579,0.0387307512832478
"GO:0006368",0.000688480112270847,0.999650321169577,48,125,"transcription elongation by RNA polymerase II","BP",0.0472233312356194,0.0111992533831078
